{
 "settings": {
  "target": "prism-ml/Ternary-Bonsai-2-27B-mlx-2bit",
  "split": "eval",
  "max_new": 1024,
  "bits": 4,
  "kv_bits": 8,
  "cap": 7,
  "temperature": 0.0
 },
 "drafter": "Schiltmans/Ternary-Bonsai-2-27B-DFlash2-ft5",
 "complete": true,
 "requests": [
  {
   "prompt_sha256": "c6fe8f3f4494f5c200938cb63bf2c9c57b95adbbbf0a8b13cc398518dabd935a",
   "category": "explanation",
   "thinking": true,
   "tokens": 427,
   "rounds": 157,
   "decode_seconds": 32.1492280960083,
   "finish": "stop",
   "response_ids": [1596, 1144, 4087, 1156, 25, 328, 814, 20139, 3069, 15127, 11822, 310, 264, 28279, 4514, 6086, 13, 8904, 279, 93974, 421, 7094, 8311, 1521, 8964, 369, 11784, 310, 279, 7806, 1149, 14235, 1534, 4087, 13, 14235, 381, 2708, 364, 220, 16, 17, 4514, 6086, 13, 79091, 15127, 4016, 310, 35003, 11, 524, 5821, 13, 8904, 93974, 25, 8964, 579, 25659, 75124, 908, 694, 5821, 22273, 2526, 26, 3404, 8964, 369, 17554, 310, 7806, 303, 5869, 318, 692, 6778, 300, 289, 8, 321, 2944, 58793, 303, 5589, 318, 1294, 300, 289, 681, 748, 413, 5821, 8613, 15127, 11, 16430, 92465, 12050, 1000, 381, 7094, 13, 64932, 4016, 310, 35003, 13969, 2086, 25111, 321, 2984, 314, 50273, 13, 5272, 53253, 25, 75727, 383, 82951, 23170, 13, 82210, 2107, 16770, 284, 62449, 13600, 15127, 13, 10380, 2830, 3069, 7094, 25, 777, 2050, 37728, 11, 4860, 2756, 11, 777, 4649, 791, 9057, 2982, 13, 19488, 25, 1678, 7327, 11, 22602, 2756, 13, 11902, 6454, 528, 8869, 13, 13262, 4092, 19413, 23516, 13, 16018, 2830, 4145, 6673, 30, 2717, 5689, 13, 14235, 1534, 1132, 13, 198, 248069, 271, 33704, 82, 3420, 1521, 8964, 725, 7772, 369, 82951, 11, 524, 1521, 8964, 5055, 11784, 310, 466, 41211, 494, 279, 7806, 13, 271, 49338, 8964, 430, 264, 23170, 440, 264, 44579, 15239, 1472, 279, 1844, 321, 5445, 13, 2844, 44579, 369, 8964, 725, 7772, 13, 8964, 369, 82951, 883, 220, 17, 18, 13, 20, 11995, 430, 424, 33060, 2094, 279, 7806, 13, 271, 4350, 279, 16430, 92465, 369, 82951, 8574, 279, 7806, 11, 37728, 12611, 424, 777, 5774, 11, 321, 2756, 513, 4860, 13, 2844, 3254, 777, 37728, 321, 777, 8364, 11, 748, 424, 725, 7094, 303, 279, 16430, 92465, 13, 2332, 279, 1788, 854, 11, 279, 15765, 92465, 369, 82951, 3023, 494, 279, 7806, 11, 748, 424, 5055, 2599, 2050, 37728, 321, 22602, 2756, 11, 3154, 424, 12050, 1017, 13, 271, 760, 13600, 8311, 4590, 3818, 2843, 13, 271, 32, 4047, 16036, 369, 310, 1683, 7094, 8311, 1521, 8964, 369, 11784, 310, 279, 7806, 13, 1921, 8964, 725, 25659, 369, 524, 264, 4574, 12307, 11, 321, 279, 6463, 303, 5821, 369, 524, 2330, 3213, 310, 5073, 15127, 13, 733, 2029, 11, 8964, 369, 3404, 17554, 310, 279, 7806, 303, 3988, 5869, 11, 864, 369, 12050, 303, 279, 16430, 92465, 13, 1368, 5821, 8613, 15127, 11, 421, 1000, 381, 7094, 11, 524, 12050, 13, 271, 4272, 279, 1822, 2781, 364, 15127, 369, 8964, 725, 35003, 11, 864, 4203, 1204, 1691, 37728, 1754, 4139, 314, 8964, 5055, 321, 1204, 1248, 279, 2756, 513, 13, 248046],
   "round_lengths": [8, 8, 8, 8, 4, 2, 7, 1, 3, 1, 2, 4, 2, 2, 2, 1, 1, 3, 1, 2, 4, 3, 4, 4, 3, 2, 3, 1, 2, 1, 2, 3, 1, 1, 1, 2, 1, 1, 1, 1, 4, 2, 2, 1, 2, 1, 1, 1, 3, 2, 2, 3, 1, 1, 1, 4, 2, 3, 1, 2, 1, 1, 1, 2, 3, 1, 2, 3, 1, 3, 2, 2, 4, 1, 1, 5, 5, 1, 1, 2, 4, 3, 2, 6, 3, 3, 1, 2, 1, 4, 2, 1, 4, 3, 2, 2, 3, 2, 6, 2, 5, 3, 1, 4, 2, 3, 2, 2, 3, 4, 2, 2, 3, 8, 3, 7, 7, 3, 4, 2, 4, 1, 2, 2, 3, 3, 6, 1, 1, 4, 3, 2, 1, 4, 1, 8, 3, 6, 3, 2, 6, 1, 1, 3, 3, 3, 5, 1, 1, 3, 3, 6, 1, 2, 2, 3, 5]
  },
  {
   "prompt_sha256": "4dbfdb471e580f7781ff051dd06e51aa6a2a35a36340878e86a9e052a41ae917",
   "category": "explanation",
   "thinking": false,
   "tokens": 376,
   "rounds": 145,
   "decode_seconds": 28.269625663757324,
   "finish": "stop",
   "response_ids": [332, 760, 18862, 15202, 25, 357, 7126, 725, 90346, 5972, 13, 10643, 62622, 332, 271, 37405, 314, 2972, 14764, 332, 430, 264, 1637, 725, 2972, 76, 1338, 332, 383, 264, 3050, 1834, 11, 321, 2972, 90540, 332, 430, 421, 1637, 725, 2972, 8716, 2632, 159034, 271, 9, 256, 2972, 28034, 318, 44, 1338, 188912, 10875, 11, 488, 2493, 381, 1046, 6540, 11, 11692, 11, 18647, 11, 466, 6051, 13, 1049, 4203, 494, 6258, 310, 6258, 321, 1834, 310, 1834, 13, 1394, 628, 1357, 6805, 6681, 1204, 488, 4548, 2579, 16089, 1066, 539, 13660, 1204, 488, 6273, 3242, 13, 198, 9, 256, 2972, 79214, 318, 10364, 2632, 188912, 5875, 279, 1248, 4496, 11, 488, 1366, 488, 3029, 8524, 449, 34745, 1637, 852, 15338, 4477, 321, 52482, 16850, 55429, 13, 7183, 413, 488, 599, 264, 3743, 1834, 318, 13458, 8831, 681, 678, 7830, 3542, 318, 90540, 8, 8198, 12594, 13, 271, 332, 8791, 279, 18862, 15202, 15164, 82, 6087, 64700, 271, 16, 13, 220, 2972, 1409, 23837, 64700, 357, 1637, 725, 16784, 628, 2222, 11602, 888, 264, 18458, 4016, 310, 28911, 11, 6310, 11, 466, 2199, 4216, 13, 29539, 11, 4611, 11, 369, 4364, 888, 348, 1129, 10086, 466, 92325, 19315, 1049, 725, 16323, 14733, 383, 3611, 2942, 29211, 13, 198, 17, 13, 220, 2972, 34, 11516, 2632, 64700, 4465, 19070, 369, 8613, 539, 13522, 11, 5138, 11, 466, 2716, 9375, 8976, 9085, 318, 64, 3743, 3603, 725, 5894, 11, 264, 44464, 3847, 553, 21926, 369, 8613, 539, 6150, 42900, 20665, 11, 694, 9682, 369, 15749, 539, 1248, 9375, 9085, 1040, 8964, 725, 25659, 11, 12570, 2468, 11, 321, 35341, 6605, 30334, 13, 198, 18, 13, 220, 2972, 54250, 2803, 64700, 357, 1637, 725, 1001, 8716, 2632, 828, 318, 90540, 8, 628, 599, 6552, 1834, 4534, 10902, 62368, 318, 76, 8792, 75100, 8, 421, 513, 1990, 919, 314, 279, 4220, 13, 733, 9682, 7785, 11, 567, 1353, 506, 348, 7028, 1098, 9, 321, 348, 419, 1763, 287, 9, 888, 10476, 13, 357, 3074, 3882, 1834, 318, 14764, 8, 3070, 1357, 2222, 279, 9682, 11, 694, 264, 6206, 303, 279, 348, 16694, 9, 9039, 888, 220, 18, 15, 1578, 1503, 13, 271, 623, 2716, 25, 2972, 28034, 369, 1092, 488, 9558, 3242, 26, 9682, 369, 678, 44223, 159029, 248046],
   "round_lengths": [4, 1, 1, 1, 2, 2, 4, 2, 4, 7, 2, 8, 8, 4, 1, 3, 5, 3, 2, 3, 2, 1, 1, 1, 3, 3, 4, 1, 1, 1, 5, 2, 4, 8, 3, 1, 4, 2, 3, 1, 2, 2, 1, 2, 1, 2, 3, 3, 1, 1, 3, 2, 1, 1, 3, 4, 4, 3, 2, 4, 1, 2, 3, 2, 3, 1, 3, 2, 3, 1, 2, 1, 3, 2, 1, 1, 2, 2, 2, 1, 2, 8, 2, 4, 3, 2, 2, 1, 1, 1, 2, 3, 2, 1, 4, 1, 2, 4, 2, 7, 2, 2, 3, 2, 3, 4, 5, 6, 1, 3, 3, 2, 1, 5, 2, 1, 4, 3, 1, 1, 2, 2, 1, 2, 4, 2, 4, 1, 2, 2, 2, 5, 3, 3, 2, 1, 3, 6, 3, 5, 3, 1, 4, 1, 2]
  },
  {
   "prompt_sha256": "53d2d14b29e92a87d2d846b03ac4c942642e1022eda3ecb79b9ac3c7663a5ceb",
   "category": "explanation",
   "thinking": true,
   "tokens": 538,
   "rounds": 202,
   "decode_seconds": 39.489534854888916,
   "finish": "stop",
   "response_ids": [1596, 1144, 4087, 1156, 25, 328, 9930, 1503, 10371, 264, 25493, 383, 264, 3229, 1438, 2919, 42244, 30, 79091, 4649, 8059, 1973, 1608, 36655, 1149, 14235, 3300, 42351, 15673, 13, 14235, 1534, 4087, 13, 14235, 381, 16097, 25, 25493, 8346, 2919, 42244, 30, 1049, 24469, 8364, 4557, 11, 43082, 19695, 11, 12339, 7035, 9781, 11, 24096, 48161, 1406, 11, 694, 1822, 2376, 369, 17191, 3514, 92245, 14, 45033, 12092, 321, 384, 76482, 17157, 11, 748, 777, 4649, 494, 42558, 5601, 1083, 22842, 2919, 13, 7054, 25493, 628, 9464, 1081, 19695, 321, 70038, 1142, 11, 13064, 40290, 8364, 30, 6558, 579, 10453, 1973, 36655, 13, 79091, 4649, 8059, 25, 42558, 29612, 8364, 310, 3229, 11, 3229, 310, 2919, 13, 9664, 85895, 948, 4649, 1879, 888, 6371, 17157, 321, 5529, 40290, 8364, 364, 36405, 1954, 13, 16643, 25493, 11, 3882, 19695, 62910, 14885, 4649, 3023, 26, 3594, 3294, 2919, 1027, 2971, 11, 384, 76482, 26, 25493, 9714, 19695, 321, 3594, 11, 1583, 22433, 11, 13205, 2919, 43442, 13, 4188, 19695, 9464, 4140, 383, 25493, 321, 47749, 1630, 1142, 11, 6866, 1142, 1010, 4649, 13, 326, 4009, 7035, 5096, 24096, 48161, 1406, 11, 748, 2919, 1189, 1144, 264, 2612, 777, 8364, 310, 42244, 11, 694, 1521, 17157, 513, 1691, 8882, 11, 424, 23716, 48161, 10281, 321, 25710, 48161, 440, 2599, 4649, 13, 14235, 6970, 35932, 328, 8389, 2919, 42244, 1, 524, 539, 3154, 2919, 76208, 30, 1049, 8346, 539, 17191, 4649, 4557, 13, 16018, 6088, 413, 25493, 369, 9990, 11, 7035, 12339, 11, 48161, 1406, 35937, 11, 748, 3404, 48161, 1406, 4918, 26, 694, 303, 17248, 16725, 11, 25493, 579, 1822, 8495, 369, 14588, 13, 14235, 874, 36655, 13, 10380, 2830, 53253, 13, 28320, 874, 36655, 13, 12650, 61446, 694, 16908, 13, 198, 248069, 271, 94527, 264, 25493, 383, 264, 3229, 8346, 2919, 42244, 14156, 539, 2972, 265, 1019, 5933, 4649, 4557, 159034, 271, 4350, 279, 42558, 73944, 279, 3229, 11, 4649, 26565, 25, 271, 332, 267, 962, 11069, 3229, 11069, 2919, 332, 271, 2381, 2919, 310, 42244, 11, 424, 3749, 3213, 4649, 310, 2404, 14058, 2919, 1083, 19695, 13, 16643, 264, 25493, 11, 264, 2609, 314, 421, 4649, 62910, 25, 271, 12, 2972, 40268, 35937, 321, 10583, 279, 3229, 93868, 14885, 4649, 440, 424, 13, 198, 12, 2972, 19557, 3594, 3294, 279, 2919, 369, 12215, 539, 34635, 3594, 93868, 748, 8364, 369, 5384, 539, 384, 76482, 13, 198, 12, 561, 2919, 7099, 1027, 2971, 777, 6497, 11, 748, 777, 4649, 369, 4221, 1066, 310, 2426, 424, 7948, 13, 271, 32, 25493, 9714, 421, 12092, 13, 1049, 43082, 19695, 321, 3882, 3594, 3294, 279, 2919, 11, 748, 279, 2919, 31130, 2599, 4649, 310, 279, 37796, 13, 4188, 314, 279, 19695, 1048, 9464, 4140, 383, 279, 4613, 314, 279, 25493, 321, 47749, 1630, 1142, 1083, 279, 3229, 11, 13064, 264, 2545, 314, 1141, 4649, 310, 279, 2919, 13, 271, 3733, 369, 1048, 264, 2526, 2376, 25, 264, 9990, 25493, 628, 9781, 5096, 279, 7035, 3294, 279, 2919, 11, 864, 24096, 279, 48161, 1406, 264, 2612, 13, 1921, 279, 1822, 2781, 264, 25493, 8346, 369, 421, 424, 2972, 432, 6902, 777, 314, 279, 42558, 725, 4649, 303, 279, 2919, 93868, 748, 279, 2919, 23716, 48161, 10281, 321, 5533, 2599, 4649, 7830, 13, 248046],